{
  "site": "DraftKings",
  "sport": "NFL",
  "slate_id": "main_slate_123",
  "draft_group_id": "123456",
  "name": "NFL $5M Midseason Main Event [$1M to 1st]",
  "start_time": "2025-09-17T17:00:00Z",
  "salary_cap": 50000,
  "roster_positions": ["QB", "RB", "RB", "WR", "WR", "WR", "TE", "FLEX", "DST"],
  "generated_at": "2025-09-17T12:00:00Z",
  "players": [
    {
      "player_id": "1",
      "display_name": "Josh Allen",
      "first_name": "Josh",
      "last_name": "Allen",
      "position": "QB",
      "positions": ["QB"],
      "salary": 8800,
      "team_abbreviation": "BUF",
      "opponent": "KC",
      "game_start": "2025-09-17T17:00:00Z",
      "status": "ACTIVE",
      "is_captain_eligible": false
    },
    {
      "player_id": "2",
      "display_name": "Patrick Mahomes",
      "first_name": "Patrick",
      "last_name": "Mahomes",
      "position": "QB",
      "positions": ["QB"],
      "salary": 8600,
      "team_abbreviation": "KC",
      "opponent": "BUF",
      "game_start": "2025-09-17T17:00:00Z",
      "status": "ACTIVE",
      "is_captain_eligible": false
    },
    {
      "player_id": "3",
      "display_name": "Stefon Diggs",
      "first_name": "Stefon",
      "last_name": "Diggs",
      "position": "WR",
      "positions": ["WR"],
      "salary": 8200,
      "team_abbreviation": "BUF",
      "opponent": "KC",
      "game_start": "2025-09-17T17:00:00Z",
      "status": "ACTIVE",
      "is_captain_eligible": false
    },
    {
      "player_id": "4",
      "display_name": "Travis Kelce",
      "first_name": "Travis",
      "last_name": "Kelce",
      "position": "TE",
      "positions": ["TE"],
      "salary": 7800,
      "team_abbreviation": "KC",
      "opponent": "BUF",
      "game_start": "2025-09-17T17:00:00Z",
      "status": "ACTIVE",
      "is_captain_eligible": false
    },
    {
      "player_id": "5",
      "display_name": "Tyreek Hill",
      "first_name": "Tyreek",
      "last_name": "Hill",
      "position": "WR",
      "positions": ["WR"],
      "salary": 7600,
      "team_abbreviation": "KC",
      "opponent": "BUF",
      "game_start": "2025-09-17T17:00:00Z",
      "status": "ACTIVE",
      "is_captain_eligible": false
    },
    {
      "player_id": "6",
      "display_name": "James Cook",
      "first_name": "James",
      "last_name": "Cook",
      "position": "RB",
      "positions": ["RB"],
      "salary": 7400,
      "team_abbreviation": "BUF",
      "opponent": "KC",
      "game_start": "2025-09-17T17:00:00Z",
      "status": "ACTIVE",
      "is_captain_eligible": false
    },
    {
      "player_id": "7",
      "display_name": "Isiah Pacheco",
      "first_name": "Isiah",
      "last_name": "Pacheco",
      "position": "RB",
      "positions": ["RB"],
      "salary": 7200,
      "team_abbreviation": "KC",
      "opponent": "BUF",
      "game_start": "2025-09-17T17:00:00Z",
      "status": "ACTIVE",
      "is_captain_eligible": false
    },
    {
      "player_id": "8",
      "display_name": "Gabe Davis",
      "first_name": "Gabe",
      "last_name": "Davis",
      "position": "WR",
      "positions": ["WR"],
      "salary": 6800,
      "team_abbreviation": "BUF",
      "opponent": "KC",
      "game_start": "2025-09-17T17:00:00Z",
      "status": "ACTIVE",
      "is_captain_eligible": false
    },
    {
      "player_id": "9",
      "display_name": "Dawson Knox",
      "first_name": "Dawson",
      "last_name": "Knox",
      "position": "TE",
      "positions": ["TE"],
      "salary": 6400,
      "team_abbreviation": "BUF",
      "opponent": "KC",
      "game_start": "2025-09-17T17:00:00Z",
      "status": "ACTIVE",
      "is_captain_eligible": false
    },
    {
      "player_id": "10",
      "display_name": "JuJu Smith-Schuster",
      "first_name": "JuJu",
      "last_name": "Smith-Schuster",
      "position": "WR",
      "positions": ["WR"],
      "salary": 6200,
      "team_abbreviation": "KC",
      "opponent": "BUF",
      "game_start": "2025-09-17T17:00:00Z",
      "status": "ACTIVE",
      "is_captain_eligible": false
    },
    {
      "player_id": "11",
      "display_name": "Dak Prescott",
      "first_name": "Dak",
      "last_name": "Prescott",
      "position": "QB",
      "positions": ["QB"],
      "salary": 8400,
      "team_abbreviation": "DAL",
      "opponent": "SF",
      "game_start": "2025-09-17T20:25:00Z",
      "status": "ACTIVE",
      "is_captain_eligible": false
    },
    {
      "player_id": "12",
      "display_name": "Brock Purdy",
      "first_name": "Brock",
      "last_name": "Purdy",
      "position": "QB",
      "positions": ["QB"],
      "salary": 8000,
      "team_abbreviation": "SF",
      "opponent": "DAL",
      "game_start": "2025-09-17T20:25:00Z",
      "status": "ACTIVE",
      "is_captain_eligible": false
    },
    {
      "player_id": "13",
      "display_name": "CeeDee Lamb",
      "first_name": "CeeDee",
      "last_name": "Lamb",
      "position": "WR",
      "positions": ["WR"],
      "salary": 8600,
      "team_abbreviation": "DAL",
      "opponent": "SF",
      "game_start": "2025-09-17T20:25:00Z",
      "status": "ACTIVE",
      "is_captain_eligible": false
    },
    {
      "player_id": "14",
      "display_name": "Deebo Samuel",
      "first_name": "Deebo",
      "last_name": "Samuel",
      "position": "WR",
      "positions": ["WR"],
      "salary": 8000,
      "team_abbreviation": "SF",
      "opponent": "DAL",
      "game_start": "2025-09-17T20:25:00Z",
      "status": "ACTIVE",
      "is_captain_eligible": false
    },
    {
      "player_id": "15",
      "display_name": "Christian McCaffrey",
      "first_name": "Christian",
      "last_name": "McCaffrey",
      "position": "RB",
      "positions": ["RB"],
      "salary": 9200,
      "team_abbreviation": "SF",
      "opponent": "DAL",
      "game_start": "2025-09-17T20:25:00Z",
      "status": "ACTIVE",
      "is_captain_eligible": false
    },
    {
      "player_id": "16",
      "display_name": "Ezekiel Elliott",
      "first_name": "Ezekiel",
      "last_name": "Elliott",
      "position": "RB",
      "positions": ["RB"],
      "salary": 6800,
      "team_abbreviation": "DAL",
      "opponent": "SF",
      "game_start": "2025-09-17T20:25:00Z",
      "status": "ACTIVE",
      "is_captain_eligible": false
    },
    {
      "player_id": "17",
      "display_name": "George Kittle",
      "first_name": "George",
      "last_name": "Kittle",
      "position": "TE",
      "positions": ["TE"],
      "salary": 7600,
      "team_abbreviation": "SF",
      "opponent": "DAL",
      "game_start": "2025-09-17T20:25:00Z",
      "status": "ACTIVE",
      "is_captain_eligible": false
    },
    {
      "player_id": "18",
      "display_name": "Jake Ferguson",
      "first_name": "Jake",
      "last_name": "Ferguson",
      "position": "TE",
      "positions": ["TE"],
      "salary": 5800,
      "team_abbreviation": "DAL",
      "opponent": "SF",
      "game_start": "2025-09-17T20:25:00Z",
      "status": "ACTIVE",
      "is_captain_eligible": false
    },
    {
      "player_id": "19",
      "display_name": "Brandon Aiyuk",
      "first_name": "Brandon",
      "last_name": "Aiyuk",
      "position": "WR",
      "positions": ["WR"],
      "salary": 7400,
      "team_abbreviation": "SF",
      "opponent": "DAL",
      "game_start": "2025-09-17T20:25:00Z",
      "status": "ACTIVE",
      "is_captain_eligible": false
    },
    {
      "player_id": "20",
      "display_name": "Amari Cooper",
      "first_name": "Amari",
      "last_name": "Cooper",
      "position": "WR",
      "positions": ["WR"],
      "salary": 7000,
      "team_abbreviation": "DAL",
      "opponent": "SF",
      "game_start": "2025-09-17T20:25:00Z",
      "status": "ACTIVE",
      "is_captain_eligible": false
    },
    {
      "player_id": "21",
      "display_name": "Buffalo Bills",
      "first_name": "",
      "last_name": "",
      "position": "DST",
      "positions": ["DST"],
      "salary": 4800,
      "team_abbreviation": "BUF",
      "opponent": "KC",
      "game_start": "2025-09-17T17:00:00Z",
      "status": "ACTIVE",
      "is_captain_eligible": false
    },
    {
      "player_id": "22",
      "display_name": "Kansas City Chiefs",
      "first_name": "",
      "last_name": "",
      "position": "DST",
      "positions": ["DST"],
      "salary": 4600,
      "team_abbreviation": "KC",
      "opponent": "BUF",
      "game_start": "2025-09-17T17:00:00Z",
      "status": "ACTIVE",
      "is_captain_eligible": false
    },
    {
      "player_id": "23",
      "display_name": "Dallas Cowboys",
      "first_name": "",
      "last_name": "",
      "position": "DST",
      "positions": ["DST"],
      "salary": 4400,
      "team_abbreviation": "DAL",
      "opponent": "SF",
      "game_start": "2025-09-17T20:25:00Z",
      "status": "ACTIVE",
      "is_captain_eligible": false
    },
    {
      "player_id": "24",
      "display_name": "San Francisco 49ers",
      "first_name": "",
      "last_name": "",
      "position": "DST",
      "positions": ["DST"],
      "salary": 4200,
      "team_abbreviation": "SF",
      "opponent": "DAL",
      "game_start": "2025-09-17T20:25:00Z",
      "status": "ACTIVE",
      "is_captain_eligible": false
    }
  ]
}
